{
  "$schema": "rule-issue-adjudication-contract.schema.json",
  "schemaVersion": 1,
  "contractId": "rule-issue-adjudication-v4",
  "behaviorFiles": [
    "hosted_copilot/contracts/reconciliation/hierarchical-reconciliation-cache.schema.json",
    "hosted_copilot/contracts/reconciliation/hierarchical-reconciliation-run.schema.json",
    "hosted_copilot/contracts/reconciliation/manual-rule-relationship.schema.json",
    "hosted_copilot/contracts/reconciliation/rule-issue-adjudication-contract.schema.json",
    "hosted_copilot/contracts/reconciliation/rule-issue-adjudication-draft-v4.schema.json",
    "hosted_copilot/contracts/reconciliation/rule-issue-adjudication-input-v4.schema.json",
    "hosted_copilot/contracts/reconciliation/saved-rule-assessment.schema.json",
    "hosted_copilot/contracts/reconciliation/saved-rule-evaluation.schema.json",
    "hosted_copilot/contracts/workbench/workbench-display-v4.schema.json",
    "hosted_copilot/contracts/workbench/workbench-rule-issues-v4.schema.json",
    "hosted_copilot/tools/internal/reconciliation/Export-WorkbenchRuleIssues.ps1",
    "hosted_copilot/tools/internal/reconciliation/Invoke-CopilotReconciliationStage.ps1",
    "hosted_copilot/tools/internal/reconciliation/Invoke-ManualRuleRelationship.ps1",
    "hosted_copilot/tools/internal/reconciliation/Invoke-RuleIssueAdjudication.ps1",
    "hosted_copilot/tools/internal/reconciliation/Invoke-SavedRuleEvaluation.ps1",
    "hosted_copilot/tools/modules/reconciliation/HierarchicalReconciliation.psm1",
    "hosted_copilot/tools/modules/reconciliation/HierarchicalReconciliationState.psm1",
    "hosted_copilot/tools/modules/reconciliation/ReconciliationStageExecutor.psm1",
    "hosted_copilot/tools/modules/reconciliation/RuleIssueAdjudication.psm1",
    "hosted_copilot/tools/modules/shared/HostedCli.psm1",
    "hosted_copilot/tools/modules/shared/HostedToolkit.Helpers.psm1",
    "hosted_copilot/tools/modules/workbench/SavedRuleEvaluation.psm1",
    "hosted_copilot/tools/prompts/reconciliation/ManualRuleRelationship-v4.md",
    "hosted_copilot/tools/prompts/reconciliation/RuleIssueAdjudication-v4.md",
    "hosted_copilot/tools/prompts/shared/FileEvaluation.md",
    "hosted_copilot/tools/prompts/shared/InlineEvaluation.md",
    "hosted_copilot/tools/prompts/shared/RetryCorrection.md"
  ],
  "presentationFiles": [
    "hosted_copilot/tools/modules/reconciliation/ReconciliationStagePresentation.psm1"
  ]
}
